{
  "issue_id": "MZ-2026-09-02",
  "issue_month": "2026-09",
  "issue_number": 2,
  "working_title": "Signals In The Silence",
  "core_idea": "Storm-season interference carries a six-tone pattern Static can sense and Clever can prove",
  "theme": "Trust sensitivity without being silenced or cured",
  "satire_target": "To be established during concept stage",
  "emotional_core": "Trust sensitivity without being silenced or cured",
  "main_character": "Static",
  "supporting_characters": [
    "Lily"
  ],
  "conflict": "Static is right about the warning but overload makes him hard to use as a communicator",
  "antagonist_or_problem": "Static is right about the warning but overload makes him hard to use as a communicator",
  "setting": "Tiny device disruptions only Static notices as fall routines resume",
  "running_joke": "To be established during concept stage",
  "ending": "Old relay junction found; Static’s four-part emergency method; soft radio tone",
  "next_issue_teaser": "To be established during concept stage",
  "required_visuals": [],
  "forbidden_changes": [
    "No treating Static as irrational; no curing sensitivity; no complete Echo emblem"
  ],
  "continuity_risks": [
    "Static identity; Clever guest; six-tone motif; August cyan frequency continuity"
  ],
  "release_assets_needed": [
    "QA",
    "cover",
    "metadata",
    "social copy"
  ]
}
