{
  "issue_id": "MZ-2026-08-01",
  "issue_month": "2026-08",
  "issue_number": 1,
  "working_title": "The Last Light Of Summer",
  "core_idea": "End-of-summer festival blackouts force NeonBlue to choose overlooked people over the public spotlight",
  "theme": "Hope that can admit danger",
  "satire_target": "To be established during concept stage",
  "emotional_core": "Hope that can admit danger",
  "main_character": "NeonBlue",
  "supporting_characters": [
    "Sasha"
  ],
  "conflict": "Moving power failures and NeonBlue’s denial vs honest rescue of those left behind",
  "antagonist_or_problem": "Moving power failures and NeonBlue’s denial vs honest rescue of those left behind",
  "setting": "Six Emo Monkeys arrive at MonkeyZoo night festival; NeonBlue over-volunteers",
  "running_joke": "To be established during concept stage",
  "ending": "Reduced festival; honest hope; partial cyan Echo segment; Patch question open",
  "next_issue_teaser": "To be established during concept stage",
  "required_visuals": [],
  "forbidden_changes": [
    "No full Patch resolution; no complete six-segment Echo; no unapproved redesigns"
  ],
  "continuity_risks": [
    "NeonBlue identity; Lil Devil guest; festival locations; cyan relay / Echo motif proposed"
  ],
  "release_assets_needed": [
    "QA",
    "cover",
    "metadata",
    "social copy"
  ]
}
